{
  "mode": "math",
  "strictness": "meaning-gated",
  "target_text": "A girl had 24 marbles. She gave 9 of them to her friend. How many marbles does she have left?",
  "reading_result": {
    "local": {
      "engine": "local",
      "words": [
        {
          "text": "A",
          "expected_phonemes": [
            "ah"
          ],
          "produced_phonemes": [
            "ah"
          ],
          "error": "none",
          "accuracy": 94,
          "self_corrected": false
        },
        {
          "text": "girl",
          "expected_phonemes": [
            "g",
            "er",
            "l"
          ],
          "produced_phonemes": [
            "g",
            "er",
            "l"
          ],
          "error": "none",
          "accuracy": 94,
          "self_corrected": false
        },
        {
          "text": "had",
          "expected_phonemes": [
            "hh",
            "ae",
            "d"
          ],
          "produced_phonemes": [
            "hh",
            "ae",
            "d"
          ],
          "error": "none",
          "accuracy": 94,
          "self_corrected": false
        },
        {
          "text": "24",
          "expected_phonemes": [
            "t",
            "w",
            "eh",
            "n",
            "t",
            "iy",
            "f",
            "ao",
            "r"
          ],
          "produced_phonemes": [
            "t",
            "w",
            "eh",
            "n",
            "t",
            "iy",
            "f",
            "ao",
            "r"
          ],
          "error": "none",
          "accuracy": 94,
          "self_corrected": false
        },
        {
          "text": "marbles",
          "expected_phonemes": [
            "m",
            "aa",
            "r",
            "b",
            "ah",
            "l",
            "z"
          ],
          "produced_phonemes": [
            "m",
            "aa",
            "r",
            "b",
            "ah",
            "l",
            "z"
          ],
          "error": "none",
          "accuracy": 94,
          "self_corrected": false
        },
        {
          "text": "She",
          "expected_phonemes": [
            "sh",
            "iy"
          ],
          "produced_phonemes": [
            "sh",
            "iy"
          ],
          "error": "none",
          "accuracy": 94,
          "self_corrected": false
        },
        {
          "text": "gave",
          "expected_phonemes": [
            "g",
            "ey",
            "v"
          ],
          "produced_phonemes": [
            "g",
            "ey",
            "v"
          ],
          "error": "none",
          "accuracy": 94,
          "self_corrected": false
        },
        {
          "text": "9",
          "expected_phonemes": [
            "n",
            "ay",
            "n"
          ],
          "produced_phonemes": [
            "n",
            "ay",
            "n"
          ],
          "error": "none",
          "accuracy": 94,
          "self_corrected": false
        },
        {
          "text": "of",
          "expected_phonemes": [
            "ah",
            "v"
          ],
          "produced_phonemes": [
            "ah",
            "v"
          ],
          "error": "none",
          "accuracy": 94,
          "self_corrected": false
        },
        {
          "text": "them",
          "expected_phonemes": [
            "dh",
            "eh",
            "m"
          ],
          "produced_phonemes": [
            "dh",
            "eh",
            "m"
          ],
          "error": "none",
          "accuracy": 94,
          "self_corrected": false
        },
        {
          "text": "to",
          "expected_phonemes": [
            "t",
            "uw"
          ],
          "produced_phonemes": [
            "t",
            "uw"
          ],
          "error": "none",
          "accuracy": 94,
          "self_corrected": false
        },
        {
          "text": "her",
          "expected_phonemes": [
            "hh",
            "er"
          ],
          "produced_phonemes": [
            "hh",
            "er"
          ],
          "error": "none",
          "accuracy": 94,
          "self_corrected": false
        },
        {
          "text": "friend",
          "expected_phonemes": [
            "f",
            "r",
            "eh",
            "n",
            "d"
          ],
          "produced_phonemes": [
            "f",
            "r",
            "eh",
            "n",
            "d"
          ],
          "error": "none",
          "accuracy": 94,
          "self_corrected": false
        },
        {
          "text": "How",
          "expected_phonemes": [
            "hh",
            "aw"
          ],
          "produced_phonemes": [
            "hh",
            "aw"
          ],
          "error": "none",
          "accuracy": 94,
          "self_corrected": false
        },
        {
          "text": "many",
          "expected_phonemes": [
            "m",
            "eh",
            "n",
            "iy"
          ],
          "produced_phonemes": [
            "m",
            "eh",
            "n",
            "iy"
          ],
          "error": "none",
          "accuracy": 94,
          "self_corrected": false
        },
        {
          "text": "marbles",
          "expected_phonemes": [
            "m",
            "aa",
            "r",
            "b",
            "ah",
            "l",
            "z"
          ],
          "produced_phonemes": [
            "m",
            "aa",
            "r",
            "b",
            "ah",
            "l",
            "z"
          ],
          "error": "none",
          "accuracy": 94,
          "self_corrected": false
        },
        {
          "text": "does",
          "expected_phonemes": [
            "d",
            "ah",
            "z"
          ],
          "produced_phonemes": [
            "d",
            "ah",
            "z"
          ],
          "error": "none",
          "accuracy": 94,
          "self_corrected": false
        },
        {
          "text": "she",
          "expected_phonemes": [
            "sh",
            "iy"
          ],
          "produced_phonemes": [
            "sh",
            "iy"
          ],
          "error": "none",
          "accuracy": 94,
          "self_corrected": false
        },
        {
          "text": "have",
          "expected_phonemes": [
            "hh",
            "ae",
            "v"
          ],
          "produced_phonemes": [
            "hh",
            "ae",
            "v"
          ],
          "error": "none",
          "accuracy": 94,
          "self_corrected": false
        },
        {
          "text": "left",
          "expected_phonemes": [
            "l",
            "eh",
            "f",
            "t"
          ],
          "produced_phonemes": [
            "l",
            "eh",
            "f",
            "t"
          ],
          "error": "none",
          "accuracy": 94,
          "self_corrected": false
        }
      ],
      "accuracy": 94,
      "seconds": 8
    }
  },
  "child_answer": "33",
  "work_photo": true,
  "session_history": [
    {
      "mode": "problem-in",
      "action": "continue",
      "prompt_to_child": "Here is your problem. Read it out loud when you are ready."
    },
    {
      "mode": "reading",
      "action": "continue",
      "prompt_to_child": "Great reading. Work it out on paper, then take a photo of your working."
    }
  ]
}
